kegg_gene,kegg_orthology,delta,n_ortho,Cellular Processes - Cell growth and death,Environmental Information Processing - Signal transduction,Organismal Systems - Endocrine system,Organismal Systems - Immune system,Organismal Systems - Nervous system
C-crk adapter molecule crk,ko:K04438,contract,1,NA,ErbB signaling pathway (map04012);;MAPK signaling pathway (map04010);;Rap1 signaling pathway (map04015),"Growth hormone synthesis, secretion and action (map04935);;Insulin signaling pathway (map04910)",Chemokine signaling pathway (map04062);;Fc gamma R-mediated phagocytosis (map04666),Neurotrophin signaling pathway (map04722)
DNA-directed RNA polymerase III subunit RPC5,ko:K14721,expand,1,NA,NA,NA,Cytosolic DNA-sensing pathway (map04623),NA
DNA-directed RNA polymerases I and III subunit RPAC1,ko:K03027,expand,1,NA,NA,NA,Cytosolic DNA-sensing pathway (map04623),NA
E3 ubiquitin-protein ligase NEDD4 [EC:2.3.2.26],ko:K10591,expand,1,NA,MAPK signaling pathway - yeast (map04011),NA,NA,NA
"FERM, RhoGEF and pleckstrin domain protein 2",ko:K06082,expand,2,NA,Rap1 signaling pathway (map04015),NA,NA,NA
KISS1 receptor,ko:K08374,expand,1,NA,NA,GnRH secretion (map04929),NA,NA
"MFS transporter, ACS family, solute carrier family 17 (sodium-dependent inorganic phosphate cotransporter), member 6/7/8",ko:K12302,expand,1,NA,NA,NA,NA,Glutamatergic synapse (map04724);;Retrograde endocannabinoid signaling (map04723);;Synaptic vesicle cycle (map04721)
"MFS transporter, DHA1 family, solute carrier family 18 (vesicular acetylcholine transporter), member 3",ko:K14636,contract,1,NA,NA,NA,NA,Cholinergic synapse (map04725);;Synaptic vesicle cycle (map04721)
"NACHT, LRR and PYD domains-containing protein 12",ko:K20865,contract,1,NA,NA,NA,NOD-like receptor signaling pathway (map04621),NA
Notch 2,ko:K20994,contract,2,NA,Notch signaling pathway (map04330),Thyroid hormone signaling pathway (map04919),Th1 and Th2 cell differentiation (map04658),NA
Notch 3,ko:K20995,expand,1,NA,Apelin signaling pathway (map04371);;Notch signaling pathway (map04330),Thyroid hormone signaling pathway (map04919),Th1 and Th2 cell differentiation (map04658),NA
RING finger and CHY zinc finger domain-containing protein 1 [EC:2.3.2.27],ko:K10144,contract,3,p53 signaling pathway (map04115),NA,NA,NA,NA
RING finger and CHY zinc finger domain-containing protein 1 [EC:2.3.2.27],ko:K10144,expand,1,p53 signaling pathway (map04115),NA,NA,NA,NA
Ras-related protein Rab-8A,ko:K07901,expand,1,NA,AMPK signaling pathway (map04152),NA,NA,NA
Ras-specific guanine nucleotide-releasing factor 2,ko:K12326,contract,1,NA,MAPK signaling pathway (map04010);;Ras signaling pathway (map04014),NA,NA,NA
Rho guanine nucleotide exchange factor 11,ko:K12331,contract,1,NA,NA,"Parathyroid hormone synthesis, secretion and action (map04928)",NA,NA
S-phase kinase-associated protein 1,ko:K03094,contract,1,Cell cycle (map04110);;Cell cycle - yeast (map04111);;Oocyte meiosis (map04114),Hedgehog signaling pathway - fly (map04341);;TGF-beta signaling pathway (map04350);;Wnt signaling pathway (map04310),NA,NA,NA
TNF receptor-associated factor 2 [EC:2.3.2.27],ko:K03173,expand,1,Apoptosis (map04210);;Necroptosis (map04217),MAPK signaling pathway (map04010);;NF-kappa B signaling pathway (map04064);;Sphingolipid signaling pathway (map04071);;TNF signaling pathway (map04668),Adipocytokine signaling pathway (map04920),IL-17 signaling pathway (map04657);;NOD-like receptor signaling pathway (map04621);;RIG-I-like receptor signaling pathway (map04622),NA
TNF receptor-associated factor 6 [EC:2.3.2.27],ko:K03175,contract,2,Apoptosis - fly (map04214),MAPK signaling pathway (map04010);;MAPK signaling pathway - fly (map04013);;NF-kappa B signaling pathway (map04064),NA,IL-17 signaling pathway (map04657);;NOD-like receptor signaling pathway (map04621);;RIG-I-like receptor signaling pathway (map04622);;Toll-like receptor signaling pathway (map04620),Neurotrophin signaling pathway (map04722)
TNF receptor-associated factor 6 [EC:2.3.2.27],ko:K03175,expand,1,Apoptosis - fly (map04214),MAPK signaling pathway (map04010);;MAPK signaling pathway - fly (map04013);;NF-kappa B signaling pathway (map04064),NA,IL-17 signaling pathway (map04657);;NOD-like receptor signaling pathway (map04621);;RIG-I-like receptor signaling pathway (map04622);;Toll-like receptor signaling pathway (map04620),Neurotrophin signaling pathway (map04722)
actin-related protein 2,ko:K17260,expand,1,NA,NA,NA,Fc gamma R-mediated phagocytosis (map04666),NA
adenosine receptor A2b,ko:K04267,contract,1,NA,Calcium signaling pathway (map04020);;Rap1 signaling pathway (map04015),NA,NA,NA
adrenergic receptor beta-2,ko:K04142,contract,2,NA,Calcium signaling pathway (map04020);;cAMP signaling pathway (map04024);;cGMP-PKG signaling pathway (map04022),Regulation of lipolysis in adipocytes (map04923);;Renin secretion (map04924),NA,NA
adrenergic receptor beta-2,ko:K04142,expand,4,NA,Calcium signaling pathway (map04020);;cAMP signaling pathway (map04024);;cGMP-PKG signaling pathway (map04022),Regulation of lipolysis in adipocytes (map04923);;Renin secretion (map04924),NA,NA
alkaline phosphatase [EC:3.1.3.1],ko:K01077,contract,1,NA,Two-component system (map02020),NA,NA,NA
ankyrin,ko:K10380,contract,3,NA,NA,NA,Toll and Imd signaling pathway (map04624),NA
ankyrin,ko:K10380,expand,5,NA,NA,NA,Toll and Imd signaling pathway (map04624),NA
apoptotic protease-activating factor,ko:K02084,contract,1,Apoptosis (map04210);;Apoptosis - fly (map04214);;Apoptosis - multiple species (map04215);;p53 signaling pathway (map04115),NA,NA,NA,NA
arachidonate 15-lipoxygenase (second type) / 8-lipoxygenase (S-type) [EC:1.13.11.33 1.13.11.-],ko:K08022,contract,1,NA,NA,NA,NA,Serotonergic synapse (map04726)
atrial natriuretic peptide receptor A [EC:4.6.1.2],ko:K12323,contract,1,NA,cAMP signaling pathway (map04024);;cGMP-PKG signaling pathway (map04022),Aldosterone synthesis and secretion (map04925);;Oxytocin signaling pathway (map04921);;Regulation of lipolysis in adipocytes (map04923);;Renin secretion (map04924),NA,NA
atrial natriuretic peptide receptor A [EC:4.6.1.2],ko:K12323,expand,1,NA,cAMP signaling pathway (map04024);;cGMP-PKG signaling pathway (map04022),Aldosterone synthesis and secretion (map04925);;Oxytocin signaling pathway (map04921);;Regulation of lipolysis in adipocytes (map04923);;Renin secretion (map04924),NA,NA
cAMP-specific phosphodiesterase 4 [EC:3.1.4.53],ko:K13293,contract,1,NA,cAMP signaling pathway (map04024),"Parathyroid hormone synthesis, secretion and action (map04928)",NA,NA
calmodulin,ko:K02183,expand,1,Cellular senescence (map04218);;Oocyte meiosis (map04114),Apelin signaling pathway (map04371);;Calcium signaling pathway (map04020);;MAPK signaling pathway - plant (map04016);;Phosphatidylinositol signaling system (map04070);;Rap1 signaling pathway (map04015);;Ras signaling pathway (map04014);;cAMP signaling pathway (map04024);;cGMP-PKG signaling pathway (map04022),Aldosterone synthesis and secretion (map04925);;Estrogen signaling pathway (map04915);;Glucagon signaling pathway (map04922);;GnRH signaling pathway (map04912);;Insulin signaling pathway (map04910);;Melanogenesis (map04916);;Oxytocin signaling pathway (map04921);;Renin secretion (map04924),C-type lectin receptor signaling pathway (map04625),Dopaminergic synapse (map04728);;Long-term potentiation (map04720);;Neurotrophin signaling pathway (map04722)
caspase 2 [EC:3.4.22.55],ko:K02186,expand,1,Apoptosis (map04210),NA,NA,NA,NA
caspase 3 [EC:3.4.22.56],ko:K02187,contract,1,Apoptosis (map04210);;Apoptosis - multiple species (map04215);;p53 signaling pathway (map04115),MAPK signaling pathway (map04010);;TNF signaling pathway (map04668),NA,Cytosolic DNA-sensing pathway (map04623);;IL-17 signaling pathway (map04657);;Natural killer cell mediated cytotoxicity (map04650),Serotonergic synapse (map04726)
cathepsin L [EC:3.4.22.15],ko:K01365,expand,1,Apoptosis (map04210),NA,NA,Antigen processing and presentation (map04612),NA
coagulation factor VIII,ko:K03899,contract,1,NA,NA,NA,Complement and coagulation cascades (map04610),NA
collagen type II alpha,ko:K19719,expand,1,NA,PI3K-Akt signaling pathway (map04151),NA,NA,NA
collagen type VI alpha,ko:K06238,contract,1,NA,PI3K-Akt signaling pathway (map04151),NA,NA,NA
collagen type VI alpha,ko:K06238,expand,2,NA,PI3K-Akt signaling pathway (map04151),NA,NA,NA
cyclin-dependent kinase 2 [EC:2.7.11.22],ko:K02206,contract,1,Cell cycle (map04110);;Cellular senescence (map04218);;Oocyte meiosis (map04114);;p53 signaling pathway (map04115),FoxO signaling pathway (map04068);;PI3K-Akt signaling pathway (map04151),Progesterone-mediated oocyte maturation (map04914),NA,NA
cyclin-dependent kinase 2 [EC:2.7.11.22],ko:K02206,expand,1,Cell cycle (map04110);;Cellular senescence (map04218);;Oocyte meiosis (map04114);;p53 signaling pathway (map04115),FoxO signaling pathway (map04068);;PI3K-Akt signaling pathway (map04151),Progesterone-mediated oocyte maturation (map04914),NA,NA
cystinyl aminopeptidase [EC:3.4.11.3],ko:K01257,expand,1,NA,NA,Renin-angiotensin system (map04614),NA,NA
cytosolic phospholipase A2 [EC:3.1.1.4],ko:K16342,contract,1,Necroptosis (map04217),MAPK signaling pathway (map04010);;Phospholipase D signaling pathway (map04072);;Ras signaling pathway (map04014);;VEGF signaling pathway (map04370),GnRH signaling pathway (map04912);;Ovarian steroidogenesis (map04913);;Oxytocin signaling pathway (map04921),Fc epsilon RI signaling pathway (map04664);;Fc gamma R-mediated phagocytosis (map04666);;Platelet activation (map04611),Glutamatergic synapse (map04724);;Long-term depression (map04730);;Serotonergic synapse (map04726)
dopamine receptor D1,ko:K04144,contract,1,NA,Calcium signaling pathway (map04020);;cAMP signaling pathway (map04024),NA,NA,Dopaminergic synapse (map04728)
dual specificity tyrosine-phosphorylation-regulated kinase 2/3/4 [EC:2.7.12.1],ko:K18669,contract,1,Cell cycle - yeast (map04111),NA,NA,NA,NA
exocyst complex component 2,ko:K17637,contract,1,NA,Ras signaling pathway (map04014),NA,NA,NA
factor associated with neutral sphingomyelinase activation,ko:K18953,contract,1,NA,Sphingolipid signaling pathway (map04071),NA,NA,NA
fibroblast growth factor 1,ko:K18496,contract,1,NA,Calcium signaling pathway (map04020);;Hippo signaling pathway (map04390);;MAPK signaling pathway (map04010);;PI3K-Akt signaling pathway (map04151);;Rap1 signaling pathway (map04015);;Ras signaling pathway (map04014),NA,NA,NA
fibroblast growth factor receptor 2 [EC:2.7.10.1],ko:K05093,contract,2,NA,Calcium signaling pathway (map04020);;MAPK signaling pathway (map04010);;PI3K-Akt signaling pathway (map04151);;Rap1 signaling pathway (map04015);;Ras signaling pathway (map04014),NA,NA,NA
fibroblast growth factor receptor 4 [EC:2.7.10.1],ko:K05095,contract,1,NA,Calcium signaling pathway (map04020);;MAPK signaling pathway (map04010);;PI3K-Akt signaling pathway (map04151);;Rap1 signaling pathway (map04015);;Ras signaling pathway (map04014),NA,NA,NA
gamma-aminobutyric acid receptor subunit alpha,ko:K05175,contract,1,NA,NA,NA,NA,GABAergic synapse (map04727);;Retrograde endocannabinoid signaling (map04723)
gamma-aminobutyric acid receptor subunit alpha,ko:K05175,expand,1,NA,NA,NA,NA,GABAergic synapse (map04727);;Retrograde endocannabinoid signaling (map04723)
gamma-aminobutyric acid receptor subunit rho,ko:K05190,expand,1,NA,NA,NA,NA,GABAergic synapse (map04727);;Retrograde endocannabinoid signaling (map04723)
gamma-aminobutyric acid type B receptor,ko:K04615,expand,2,NA,cAMP signaling pathway (map04024),Estrogen signaling pathway (map04915);;GnRH secretion (map04929),NA,GABAergic synapse (map04727)
guanylate-binding protein 1/3/4/7,ko:K20899,contract,1,NA,NA,NA,NOD-like receptor signaling pathway (map04621),NA
guanylate-binding protein 5,ko:K20898,expand,1,NA,NA,NA,NOD-like receptor signaling pathway (map04621),NA
hemopoietic cell kinase [EC:2.7.10.2],ko:K08893,expand,2,NA,NA,NA,Chemokine signaling pathway (map04062);;Fc gamma R-mediated phagocytosis (map04666),NA
"high affinity cAMP-specific and IBMX-insensitive 3',5'-cyclic phosphodiesterase 8 [EC:3.1.4.53]",ko:K18437,contract,1,NA,NA,Cortisol synthesis and secretion (map04927),NA,NA
histone H2A,ko:K11251,contract,1,Necroptosis (map04217),NA,NA,Neutrophil extracellular trap formation (map04613),NA
histone H3,ko:K11253,expand,1,NA,NA,NA,Neutrophil extracellular trap formation (map04613),NA
histone H4,ko:K11254,contract,1,NA,NA,NA,Neutrophil extracellular trap formation (map04613),NA
histone deacetylase 4/5 [EC:3.5.1.98],ko:K11406,contract,1,NA,Apelin signaling pathway (map04371),NA,Neutrophil extracellular trap formation (map04613),NA
inositol polyphosphate 5-phosphatase INPP5A [EC:3.1.3.56],ko:K01106,expand,1,NA,Phosphatidylinositol signaling system (map04070),Insulin signaling pathway (map04910),NA,NA
leucine-rich repeat-containing G protein-coupled receptor 4,ko:K04309,contract,1,NA,Wnt signaling pathway (map04310),NA,NA,NA
leucine-rich repeat-containing G protein-coupled receptor 4,ko:K04309,expand,1,NA,Wnt signaling pathway (map04310),NA,NA,NA
long-chain acyl-CoA synthetase [EC:6.2.1.3],ko:K01897,expand,1,Ferroptosis (map04216),NA,Adipocytokine signaling pathway (map04920);;PPAR signaling pathway (map03320),NA,NA
low density lipoprotein receptor-related protein 5/6,ko:K03068,contract,1,NA,Wnt signaling pathway (map04310);;mTOR signaling pathway (map04150),"Parathyroid hormone synthesis, secretion and action (map04928)",NA,NA
lymphocyte cell-specific protein tyrosine kinase [EC:2.7.10.2],ko:K05856,expand,1,NA,NF-kappa B signaling pathway (map04064),NA,Natural killer cell mediated cytotoxicity (map04650);;T cell receptor signaling pathway (map04660);;Th1 and Th2 cell differentiation (map04658);;Th17 cell differentiation (map04659),NA
matrix metalloproteinase-2 (gelatinase A) [EC:3.4.24.24],ko:K01398,contract,1,NA,NA,Estrogen signaling pathway (map04915);;GnRH signaling pathway (map04912);;Relaxin signaling pathway (map04926),Leukocyte transendothelial migration (map04670),NA
matrix metalloproteinase-2 (gelatinase A) [EC:3.4.24.24],ko:K01398,expand,2,NA,NA,Estrogen signaling pathway (map04915);;GnRH signaling pathway (map04912);;Relaxin signaling pathway (map04926),Leukocyte transendothelial migration (map04670),NA
melanocortin 2 receptor,ko:K04200,contract,1,NA,cAMP signaling pathway (map04024),Aldosterone synthesis and secretion (map04925);;Cortisol synthesis and secretion (map04927),NA,NA
mitogen-activated protein kinase kinase kinase [EC:2.7.11.25],ko:K11230,expand,1,NA,MAPK signaling pathway - yeast (map04011);;Two-component system (map02020),NA,NA,NA
modular serine protease [EC:3.4.21.-],ko:K20674,expand,1,NA,NA,NA,Toll and Imd signaling pathway (map04624),NA
nicotinic acetylcholine receptor alpha-7,ko:K04809,contract,1,NA,Calcium signaling pathway (map04020),NA,NA,Cholinergic synapse (map04725)
nucleotide-binding oligomerization domain-containing protein 1,ko:K08727,contract,1,NA,NA,NA,NOD-like receptor signaling pathway (map04621),NA
nucleotide-binding oligomerization domain-containing protein 1,ko:K08727,expand,1,NA,NA,NA,NOD-like receptor signaling pathway (map04621),NA
origin recognition complex subunit 6,ko:K02608,expand,1,Cell cycle (map04110);;Cell cycle - yeast (map04111);;Meiosis - yeast (map04113),NA,NA,NA,NA
paired box protein 8,ko:K09293,expand,1,NA,NA,Thyroid hormone synthesis (map04918),NA,NA
"phosphatidylinositol phospholipase C, beta [EC:3.1.4.11]",ko:K05858,contract,1,NA,Apelin signaling pathway (map04371);;Calcium signaling pathway (map04020);;Phosphatidylinositol signaling system (map04070);;Phospholipase D signaling pathway (map04072);;Rap1 signaling pathway (map04015);;Sphingolipid signaling pathway (map04071);;Wnt signaling pathway (map04310);;cGMP-PKG signaling pathway (map04022),"Aldosterone synthesis and secretion (map04925);;Cortisol synthesis and secretion (map04927);;Estrogen signaling pathway (map04915);;Glucagon signaling pathway (map04922);;GnRH secretion (map04929);;GnRH signaling pathway (map04912);;Growth hormone synthesis, secretion and action (map04935);;Insulin secretion (map04911);;Melanogenesis (map04916);;Oxytocin signaling pathway (map04921);;Parathyroid hormone synthesis, secretion and action (map04928);;Relaxin signaling pathway (map04926);;Renin secretion (map04924);;Thyroid hormone signaling pathway (map04919);;Thyroid hormone synthesis (map04918)",Chemokine signaling pathway (map04062);;NOD-like receptor signaling pathway (map04621);;Neutrophil extracellular trap formation (map04613);;Platelet activation (map04611),Cholinergic synapse (map04725);;Dopaminergic synapse (map04728);;Glutamatergic synapse (map04724);;Long-term depression (map04730);;Long-term potentiation (map04720);;Retrograde endocannabinoid signaling (map04723);;Serotonergic synapse (map04726)
"phosphoinositide-3-kinase, regulatory subunit 4 [EC:2.7.11.1]",ko:K08333,contract,1,NA,Apelin signaling pathway (map04371),NA,NA,NA
plasminogen [EC:3.4.21.7],ko:K01315,expand,1,NA,NA,NA,Complement and coagulation cascades (map04610),NA
platelet-derived growth factor receptor alpha [EC:2.7.10.1],ko:K04363,contract,1,NA,Calcium signaling pathway (map04020);;JAK-STAT signaling pathway (map04630);;MAPK signaling pathway (map04010);;PI3K-Akt signaling pathway (map04151);;Phospholipase D signaling pathway (map04072);;Rap1 signaling pathway (map04015);;Ras signaling pathway (map04014),NA,NA,NA
potassium channel subfamily K member 9,ko:K04919,expand,1,NA,NA,Aldosterone synthesis and secretion (map04925),NA,NA
protein DBF4,ko:K06629,contract,1,Cell cycle (map04110),NA,NA,NA,NA
protocadherin Fat 4,ko:K16669,contract,1,NA,Hippo signaling pathway - fly (map04391);;Hippo signaling pathway - multiple species (map04392),NA,NA,NA
receptor-type tyrosine-protein phosphatase F [EC:3.1.3.48],ko:K05695,contract,2,NA,NA,Insulin signaling pathway (map04910),NA,NA
receptor-type tyrosine-protein phosphatase F [EC:3.1.3.48],ko:K05695,expand,2,NA,NA,Insulin signaling pathway (map04910),NA,NA
regulating synaptic membrane exocytosis protein 1,ko:K15291,contract,1,NA,NA,NA,NA,Retrograde endocannabinoid signaling (map04723);;Synaptic vesicle cycle (map04721)
separase [EC:3.4.22.49],ko:K02365,expand,1,Cell cycle (map04110);;Cell cycle - yeast (map04111);;Meiosis - yeast (map04113);;Oocyte meiosis (map04114),NA,NA,NA,NA
serine/threonine-protein phosphatase 2B catalytic subunit [EC:3.1.3.16],ko:K04348,contract,1,Cellular senescence (map04218);;Oocyte meiosis (map04114),Calcium signaling pathway (map04020);;MAPK signaling pathway (map04010);;VEGF signaling pathway (map04370);;Wnt signaling pathway (map04310);;cGMP-PKG signaling pathway (map04022),Glucagon signaling pathway (map04922);;Oxytocin signaling pathway (map04921);;Renin secretion (map04924),B cell receptor signaling pathway (map04662);;C-type lectin receptor signaling pathway (map04625);;Natural killer cell mediated cytotoxicity (map04650);;T cell receptor signaling pathway (map04660);;Th1 and Th2 cell differentiation (map04658);;Th17 cell differentiation (map04659),Dopaminergic synapse (map04728);;Glutamatergic synapse (map04724);;Long-term potentiation (map04720)
serum/glucocorticoid-regulated kinase 1 [EC:2.7.11.1],ko:K13302,expand,1,NA,FoxO signaling pathway (map04068);;PI3K-Akt signaling pathway (map04151);;mTOR signaling pathway (map04150),NA,NA,NA
signaling mucin HKR1,ko:K19848,expand,1,NA,MAPK signaling pathway - yeast (map04011),NA,NA,NA
"solute carrier family 1 (neuronal/epithelial high affinity glutamate transporter), member 1",ko:K05612,expand,1,NA,NA,NA,NA,Glutamatergic synapse (map04724);;Synaptic vesicle cycle (map04721)
"solute carrier family 6 (neurotransmitter transporter, glycine) member 5/9",ko:K05038,expand,1,NA,NA,NA,NA,Synaptic vesicle cycle (map04721)
sphingosine 1-phosphate receptor 1,ko:K04288,expand,1,NA,FoxO signaling pathway (map04068);;Sphingolipid signaling pathway (map04071),NA,NA,NA
sphingosine kinase [EC:2.7.1.91],ko:K04718,contract,1,NA,Apelin signaling pathway (map04371);;Calcium signaling pathway (map04020);;Phospholipase D signaling pathway (map04072);;Sphingolipid signaling pathway (map04071);;VEGF signaling pathway (map04370),NA,Fc gamma R-mediated phagocytosis (map04666),NA
stearoyl-CoA desaturase (Delta-9 desaturase) [EC:1.14.19.1],ko:K00507,expand,1,NA,AMPK signaling pathway (map04152),PPAR signaling pathway (map03320),NA,NA
tachykinin receptor 2,ko:K04223,expand,4,NA,Calcium signaling pathway (map04020),NA,NA,NA
thyrotropin-releasing hormone receptor,ko:K04282,expand,2,NA,Calcium signaling pathway (map04020),NA,NA,NA
toll-like receptor 2,ko:K10159,expand,1,NA,PI3K-Akt signaling pathway (map04151),NA,Neutrophil extracellular trap formation (map04613);;Toll-like receptor signaling pathway (map04620),NA
toll-like receptor 6,ko:K10169,contract,1,NA,NA,NA,Toll-like receptor signaling pathway (map04620),NA
transcription initiation factor TFII-I,ko:K03121,expand,1,NA,cGMP-PKG signaling pathway (map04022),NA,NA,NA
tubulin alpha,ko:K07374,contract,1,Apoptosis (map04210),NA,NA,NA,NA
"tumor necrosis factor superfamily, member 2",ko:K03156,contract,1,Apoptosis (map04210);;Necroptosis (map04217),MAPK signaling pathway (map04010);;NF-kappa B signaling pathway (map04064);;Sphingolipid signaling pathway (map04071);;TGF-beta signaling pathway (map04350);;TNF signaling pathway (map04668);;mTOR signaling pathway (map04150),Adipocytokine signaling pathway (map04920),Antigen processing and presentation (map04612);;C-type lectin receptor signaling pathway (map04625);;Fc epsilon RI signaling pathway (map04664);;Hematopoietic cell lineage (map04640);;IL-17 signaling pathway (map04657);;NOD-like receptor signaling pathway (map04621);;Natural killer cell mediated cytotoxicity (map04650);;RIG-I-like receptor signaling pathway (map04622);;T cell receptor signaling pathway (map04660);;Toll-like receptor signaling pathway (map04620),NA
tumor protein p63,ko:K10149,contract,1,Apoptosis - fly (map04214),Hippo signaling pathway - fly (map04391),NA,NA,NA
voltage-dependent calcium channel L type alpha-1S,ko:K04857,contract,1,NA,Calcium signaling pathway (map04020);;MAPK signaling pathway (map04010);;cAMP signaling pathway (map04024);;cGMP-PKG signaling pathway (map04022),"Aldosterone synthesis and secretion (map04925);;Cortisol synthesis and secretion (map04927);;GnRH secretion (map04929);;GnRH signaling pathway (map04912);;Growth hormone synthesis, secretion and action (map04935);;Insulin secretion (map04911);;Oxytocin signaling pathway (map04921);;Renin secretion (map04924)",NA,Cholinergic synapse (map04725);;GABAergic synapse (map04727);;Retrograde endocannabinoid signaling (map04723);;Serotonergic synapse (map04726)
